{"schema":"mm/v2/stage-request","persist":true,"requestId":"agent-20260717-001","operation":"create_post","target":{"kind":"conversation","conversationType":"channel","selector":{"by":"name","value":"town-square"},"team":{"by":"name","value":"vyvo"}},"body":"hello","emoji":null,"attachments":[{"path":"/home/arda/report.pdf","remoteFilename":"report.pdf","mediaType":"application/pdf"}]}
